{
  "schema": "t4-delivery-report",
  "version": 1,
  "generated_at": "2026-10-13T15:51:40.207Z",
  "note": "Assembled from local evidence only. Ready means ready for delivery handoff — not merged, deployed or published. Contract validation is structural; it does not judge whether a requirement is right.",
  "delivery": {
    "id": "d-20261012-251ff8",
    "kind": "planned",
    "tracker_key": null,
    "title": "0002 — Milestone 2 block extraction and TeX source generation",
    "sources": [
      {
        "kind": "plan",
        "markdown": "ai-factory/plans/0002-m2-block-extraction-tex-source.md",
        "sidecar": "ai-factory/plans/0002-m2-block-extraction-tex-source.contract.json",
        "sha256": "092a3dba0e46df8cb9651dc85f9d302e17ddeb32f06cea6b3dfec3c9bbaf28e2",
        "state": "valid"
      },
      {
        "kind": "spec",
        "markdown": "ai-factory/specs/0002-m2-block-extraction-tex-source.md",
        "sidecar": "ai-factory/specs/0002-m2-block-extraction-tex-source.contract.json",
        "sha256": "56d4a50c597fd22676a73d3b3508ef9de200a07bf62d7cbd4d7c0ec74aba99ff",
        "state": "valid"
      }
    ]
  },
  "snapshot": {
    "code_sha256": "0ef13d3b7544bec2c2a249bc6cd5442a42b32221dfcbbb3629bb77c121d7e788",
    "head": "4691ba7fc2b618a8473bbeecdd0ee8b83c261426",
    "files": 149,
    "fingerprint": "2d7c14c2f2426e63de115e78d8aabf8338a0c64139107a804563825c5d45a2eb"
  },
  "status": "ready",
  "reasons": [],
  "counts": {
    "criteria": 35,
    "passed": 35,
    "attested": 0,
    "pending": 0,
    "failed": 0,
    "uncovered": 0,
    "unverified": 0
  },
  "policy": {
    "require_review": true,
    "require_review_quick": false,
    "blocking_severities": [
      "blocker"
    ],
    "allow_attestation": false
  },
  "criteria": [
    {
      "id": "AC1",
      "steps": [
        "S4"
      ],
      "tests": [
        [
          "make",
          "build/test-tex-block"
        ],
        [
          "build/test-tex-block"
        ]
      ],
      "evidence": [
        "ai-factory/evidence/d-20261012-251ff8/S4-step.json",
        "ai-factory/evidence/d-20261012-251ff8/final.json"
      ],
      "attestation": null,
      "result": "passed",
      "basis": "automated"
    },
    {
      "id": "AC2",
      "steps": [
        "S4"
      ],
      "tests": [
        [
          "make",
          "build/test-tex-block"
        ],
        [
          "build/test-tex-block"
        ]
      ],
      "evidence": [
        "ai-factory/evidence/d-20261012-251ff8/S4-step.json",
        "ai-factory/evidence/d-20261012-251ff8/final.json"
      ],
      "attestation": null,
      "result": "passed",
      "basis": "automated"
    },
    {
      "id": "AC3",
      "steps": [
        "S4"
      ],
      "tests": [
        [
          "make",
          "build/test-tex-block"
        ],
        [
          "build/test-tex-block"
        ]
      ],
      "evidence": [
        "ai-factory/evidence/d-20261012-251ff8/S4-step.json",
        "ai-factory/evidence/d-20261012-251ff8/final.json"
      ],
      "attestation": null,
      "result": "passed",
      "basis": "automated"
    },
    {
      "id": "AC4",
      "steps": [
        "S4"
      ],
      "tests": [
        [
          "make",
          "build/test-tex-block"
        ],
        [
          "build/test-tex-block"
        ]
      ],
      "evidence": [
        "ai-factory/evidence/d-20261012-251ff8/S4-step.json",
        "ai-factory/evidence/d-20261012-251ff8/final.json"
      ],
      "attestation": null,
      "result": "passed",
      "basis": "automated"
    },
    {
      "id": "AC5",
      "steps": [
        "S4"
      ],
      "tests": [
        [
          "make",
          "build/test-tex-block"
        ],
        [
          "build/test-tex-block"
        ]
      ],
      "evidence": [
        "ai-factory/evidence/d-20261012-251ff8/S4-step.json",
        "ai-factory/evidence/d-20261012-251ff8/final.json"
      ],
      "attestation": null,
      "result": "passed",
      "basis": "automated"
    },
    {
      "id": "AC6",
      "steps": [
        "S4"
      ],
      "tests": [
        [
          "make",
          "build/test-tex-block"
        ],
        [
          "build/test-tex-block"
        ]
      ],
      "evidence": [
        "ai-factory/evidence/d-20261012-251ff8/S4-step.json",
        "ai-factory/evidence/d-20261012-251ff8/final.json"
      ],
      "attestation": null,
      "result": "passed",
      "basis": "automated"
    },
    {
      "id": "AC7",
      "steps": [
        "S4"
      ],
      "tests": [
        [
          "make",
          "build/test-tex-block"
        ],
        [
          "build/test-tex-block"
        ]
      ],
      "evidence": [
        "ai-factory/evidence/d-20261012-251ff8/S4-step.json",
        "ai-factory/evidence/d-20261012-251ff8/final.json"
      ],
      "attestation": null,
      "result": "passed",
      "basis": "automated"
    },
    {
      "id": "AC8",
      "steps": [
        "S4"
      ],
      "tests": [
        [
          "make",
          "build/test-tex-block"
        ],
        [
          "build/test-tex-block"
        ]
      ],
      "evidence": [
        "ai-factory/evidence/d-20261012-251ff8/S4-step.json",
        "ai-factory/evidence/d-20261012-251ff8/final.json"
      ],
      "attestation": null,
      "result": "passed",
      "basis": "automated"
    },
    {
      "id": "AC9",
      "steps": [
        "S1"
      ],
      "tests": [
        [
          "make",
          "build/test-tex-env"
        ],
        [
          "build/test-tex-env"
        ]
      ],
      "evidence": [
        "ai-factory/evidence/d-20261012-251ff8/S1-step.json",
        "ai-factory/evidence/d-20261012-251ff8/final.json"
      ],
      "attestation": null,
      "result": "passed",
      "basis": "automated"
    },
    {
      "id": "AC10",
      "steps": [
        "S5"
      ],
      "tests": [
        [
          "make",
          "build/test-tex-block"
        ],
        [
          "build/test-tex-block"
        ]
      ],
      "evidence": [
        "ai-factory/evidence/d-20261012-251ff8/S5-step.json",
        "ai-factory/evidence/d-20261012-251ff8/final.json"
      ],
      "attestation": null,
      "result": "passed",
      "basis": "automated"
    },
    {
      "id": "AC11",
      "steps": [
        "S5"
      ],
      "tests": [
        [
          "make",
          "build/test-tex-block"
        ],
        [
          "build/test-tex-block"
        ]
      ],
      "evidence": [
        "ai-factory/evidence/d-20261012-251ff8/S5-step.json",
        "ai-factory/evidence/d-20261012-251ff8/final.json"
      ],
      "attestation": null,
      "result": "passed",
      "basis": "automated"
    },
    {
      "id": "AC12",
      "steps": [
        "S1",
        "S5"
      ],
      "tests": [
        [
          "make",
          "build/test-tex-env"
        ],
        [
          "build/test-tex-env"
        ],
        [
          "make",
          "build/test-tex-block"
        ],
        [
          "build/test-tex-block"
        ]
      ],
      "evidence": [
        "ai-factory/evidence/d-20261012-251ff8/S1-step.json",
        "ai-factory/evidence/d-20261012-251ff8/S5-step.json",
        "ai-factory/evidence/d-20261012-251ff8/final.json"
      ],
      "attestation": null,
      "result": "passed",
      "basis": "automated"
    },
    {
      "id": "AC13",
      "steps": [
        "S3",
        "S5"
      ],
      "tests": [
        [
          "make",
          "build/test-config"
        ],
        [
          "build/test-config"
        ],
        [
          "make",
          "build/test-tex-block"
        ],
        [
          "build/test-tex-block"
        ]
      ],
      "evidence": [
        "ai-factory/evidence/d-20261012-251ff8/S3-step.json",
        "ai-factory/evidence/d-20261012-251ff8/S5-step.json",
        "ai-factory/evidence/d-20261012-251ff8/final.json"
      ],
      "attestation": null,
      "result": "passed",
      "basis": "automated"
    },
    {
      "id": "AC14",
      "steps": [
        "S5"
      ],
      "tests": [
        [
          "make",
          "build/test-tex-block"
        ],
        [
          "build/test-tex-block"
        ]
      ],
      "evidence": [
        "ai-factory/evidence/d-20261012-251ff8/S5-step.json",
        "ai-factory/evidence/d-20261012-251ff8/final.json"
      ],
      "attestation": null,
      "result": "passed",
      "basis": "automated"
    },
    {
      "id": "AC15",
      "steps": [
        "S5"
      ],
      "tests": [
        [
          "make",
          "build/test-tex-block"
        ],
        [
          "build/test-tex-block"
        ]
      ],
      "evidence": [
        "ai-factory/evidence/d-20261012-251ff8/S5-step.json",
        "ai-factory/evidence/d-20261012-251ff8/final.json"
      ],
      "attestation": null,
      "result": "passed",
      "basis": "automated"
    },
    {
      "id": "AC16",
      "steps": [
        "S2",
        "S6"
      ],
      "tests": [
        [
          "make",
          "build/test-config"
        ],
        [
          "build/test-config"
        ],
        [
          "make",
          "build/test-tex-source"
        ],
        [
          "build/test-tex-source"
        ]
      ],
      "evidence": [
        "ai-factory/evidence/d-20261012-251ff8/S2-step.json",
        "ai-factory/evidence/d-20261012-251ff8/S6-step.json",
        "ai-factory/evidence/d-20261012-251ff8/final.json"
      ],
      "attestation": null,
      "result": "passed",
      "basis": "automated"
    },
    {
      "id": "AC17",
      "steps": [
        "S6"
      ],
      "tests": [
        [
          "make",
          "build/test-tex-source"
        ],
        [
          "build/test-tex-source"
        ]
      ],
      "evidence": [
        "ai-factory/evidence/d-20261012-251ff8/S6-step.json",
        "ai-factory/evidence/d-20261012-251ff8/final.json"
      ],